artist,title,lyrics
Ed Sheeran,Shape of You,"A club isn't the best place to find a lover
So the bar is where I go (Mm)
Me and my friends at the table doin' shots
Drinkin' fast and then we talk slow (Mm)
And you come over and start up a conversation with just me
And trust me, I'll give it a chance now (Mm)
Take my hand, stop, put Van the Man on the jukebox
And then we start to dance and now I'm singin' like

[Pre-Chorus]
Girl, you know I want your love
Your love was handmade for somebody like me
Well, come on now, follow my lead
I may be crazy, don't mind me
Say, ""Boy, let's not talk too much""
Grab on my waist and put that body on me
Well, come on now, follow my lead
Come, come on now, follow my lead, mm

[Chorus]
I'm in love with the shape of you
We push and pull like a magnet do
Although my heart is fallin' too
I'm in love with your body
And last night, you were in my room
And now my bed sheets smell like you
Every day, discoverin' somethin' brand new
Well, I'm in love with your body
See Ed Sheeran LiveGet tickets as low as $109You might also like[Post-Chorus]
Oh, I, oh, I, oh, I, oh, I
Well, I'm in love with your body
Oh, I, oh, I, oh, I, oh, I
Well, I'm in love with your body
Oh, I, oh, I, oh, I, oh, I
Well, I'm in love with your body
Every day, discoverin' somethin' brand new
I'm in love with the shape of you

[Verse 2]
One week in, we let the story begin
We're goin' out on our first date (Mm)
You and me are thrifty, so go all-you-can-eat
Fill up your bag and I fill up a plate (Mm)
We talk for hours and hours about the sweet and the sour
And how your family is doin' okay (Mm)
And leave and get in a taxi, and kiss in the back seat
Tell the driver make the radio play and I'm singin' like

[Pre-Chorus]
Girl, you know I want your love
Your love was handmade for somebody like me
Well, come on now, follow my lead
I may be crazy, don't mind me
Say, ""Boy, let's not talk too much""
Grab on my waist and put that body on me
Well, come on now, follow my lead
Come, come on now, follow my lead, mm
[Chorus]
I'm in love with the shape of you
We push and pull like a magnet do
Although my heart is fallin' too
I'm in love with your body
And last night, you were in my room
And now my bed sheets smell like you
Every day, discoverin' somethin' brand new
Well, I'm in love with your body

[Post-Chorus]
Oh, I, oh, I, oh, I, oh, I
Well, I'm in love with your body
Oh, I, oh, I, oh, I, oh, I
Well, I'm in love with your body
Oh, I, oh, I, oh, I, oh, I
Well, I'm in love with your body
Every day, discoverin' somethin' brand new
I'm in love with the shape of you

[Bridge]
Come on, be my baby, come on
Come on, be my baby, come on
Come on, be my baby, come on
Come on, be my baby, come on
Come on, be my baby, come on
Come on, be my baby, come on
Come on, be my baby, come on
Come on, be my baby, come on
[Chorus]
I'm in love with the shape of you
We push and pull like a magnet do
Although my heart is fallin' too
I'm in love with your body
And last night, you were in my room
And now my bed sheets smell like you
Every day, discoverin' somethin' brand new
Well, I'm in love with your body

[Outro]
Come on, be my baby, come on
Come on, be my baby, come on
I'm in love with your body
Come on, be my baby, come on
Come on, be my baby, come on
I'm in love with your body
Come on, be my baby, come on
Come on, be my baby, come on
I'm in love with your body
Every day, discoverin' somethin' brand new
I'm in love with the shape of you409Embed"
Ed Sheeran,Perfect,"I found a love for me
Oh, darlin', just dive right in and follow my lead
Well, I found a girl, beautiful and sweet
Oh, I never knew you were the someone waitin' for me

[Pre-Chorus]
'Cause we were just kids when we fell in love
Not knowin' what it was
I will not give you up this time
But, darlin', just kiss me slow
Your heart is all I own
And in your eyes, you're holdin' mine

[Chorus]
Baby, I'm dancin' in the dark with you between my arms
Barefoot on the grass while listenin' to our favourite song
When you said you looked a mess, I whispered underneath my breath
But you heard it, ""Darlin', you look perfect tonight""

[Verse 2]
Well, I found a woman stronger than anyone I know
She shares my dreams, I hope that, someday, I'll share her home
I found a love to carry more than just my secrets
To carry love, to carry children of our own
See Ed Sheeran LiveGet tickets as low as $109You might also like[Pre-Chorus]
We are still kids, but we're so in love
Fightin' against all odds
I know we'll be alright this time
Darlin', just hold my hand
Be my girl, I'll be your man
I see my future in your eyes

[Chorus]
Baby, I'm dancin' in the dark with you between my arms
Barefoot on the grass while listenin' to our favourite song
When I saw you in that dress, lookin' so beautiful
I don't deserve this, darlin', you look perfect tonight

[Bridge]
No, no, no
Mm, no, no

[Chorus]
Baby, I'm dancin' in the dark with you between my arms
We're barefoot on the grass, oh, listenin' to our favourite song
I have faith in what I see, now I know I have met
An angel in person and she looks perfect
I don't deserve this, you look perfect tonight265Embed"
Ed Sheeran,Castle On The Hill,"When I was six years old, I broke my leg
I was runnin' from my brother and his friends
And tasted the sweet perfume of the mountain grass I rolled down
I was younger then, take me back to when I

[Pre-Chorus]
Found my heart and broke it here
Made friends and lost them through the years
And I've not seen the roaring fields in so long, I know I've grown
But I can't wait to go home

[Chorus]
I'm on my way
Drivin' at ninety down those country lanes
Singin' to ""Tiny Dancer""
And I miss the way you make me feel and it's real
We watched the sunset over the castle on the hill

[Verse 2]
Fifteen years old and smoking hand-rolled cigarettes
Runnin' from the law through the backfields and gettin' drunk with my friends
Had my first kiss on a Friday night, I don't reckon that I did it right
But I was younger then, take me back to when

[Pre-Chorus]
We found weekend jobs, when we got paid
We'd buy cheap spirits and drink them straight
Me and my friends have not thrown up in so long, oh, how we've grown
But I can't wait to go home
See Ed Sheeran LiveGet tickets as low as $109You might also like[Chorus]
I'm on my way
Drivin' at ninety down those country lanes
Singin' to ""Tiny Dancer""
And I miss the way you make me feel and it's real
We watched the sunset over the castle on the hill
Over the castle on the hill
Over the castle on the hill

[Bridge]
One friend left to sell clothes
One works down by the coast
One had two kids but lives alone
One's brother overdosed
One's already on his second wife
One's just barely gettin' by
But these people raised me
And I can't wait to go home

[Chorus]
And I'm on my way, I still remember
These old country lanes
When we did not know the answers
And I miss the way you make me feel and it's real
We watched the sunset over the castle on the hill
Over the castle on the hill
Over the castle on the hill91Embed"
Ed Sheeran,Thinking Out Loud,"When your legs don't work like they used to before
And I can't sweep you off of your feet
Will your mouth still remember the taste of my love?
Will your eyes still smile from your cheeks?
And darlin', I will be lovin' you till we're seventy
And baby, my heart could still fall as hard at twenty-three

[Pre-Chorus]
And I'm thinkin' 'bout how
People fall in love in mysterious ways
Maybe just the touch of a hand
Well, me, I fall in love with you every single day
And I just wanna tell you I am

[Chorus]
So honey, now, take me into your lovin' arms
Kiss me under the light of a thousand stars
And place your head on my beatin' heart, I'm thinkin' out loud
Maybe we found love right where we are

[Verse 2]
When my hair's all but gone and my memory fades
And the crowds don't remember my name
When my hands don't play the strings the same way, mmm
I know you will still love me the same
'Cause, honey, your soul could never grow old, it's evergreen
And baby, your smile's forever in my mind and memory
See Ed Sheeran LiveGet tickets as low as $109You might also like[Pre-Chorus]
I'm thinkin' 'bout how
People fall in love in mysterious ways
And maybe it's all part of a plan
Oh, I'll just keep on makin' the same mistakes
Hoping that you'll understand

[Chorus]
That, baby, now, take me into your lovin' arms
Kiss me under the light of a thousand stars
Place your head on my beatin' heart, I'm thinkin' out loud
And maybe we found love right where we are, oh-oh

[Bridge]
Lo-lo-lo, lo-lo-lo
Lo-lo-lo, lo-lo-lo, love

[Chorus]
So baby, now, take me into your lovin' arms
And kiss me under the light of a thousand stars, oh, darlin'
Place your head on my beatin' heart, I'm thinkin' out loud
That maybe we found love right where we are
Oh, maybe we found love right where we are
And we found love right where we are876Embed"
Ed Sheeran,Happier,"Walkin' down 29th and Park
I saw you in another's arm
Only a month we've been apart
You look happier
Saw you walk inside a bar
He said somethin' to make you laugh
I saw that both your smiles were twice as wide as ours
Yeah, you look happier, you do

[Pre-Chorus]
Ain't nobody hurt you like I hurt you
But ain't nobody love you like I do
Promise that I will not take it personal, baby
If you're movin' on with someone new

[Chorus]
'Cause, baby, you look happier, you do
My friends told me one day I'll feel it too
And until then, I'll smile to hide the truth
But I know I was happier with you

[Post-Chorus]
Hey-yeah, hey-yeah, hey-yeah

[Verse 2]
Sat in the corner of the room
Everything's reminding me of you
Nursin' an empty bottle and tellin' myself
You're happier, aren't you?
(Hey-yeah, hey-yeah, hey-yeah)
See Ed Sheeran LiveGet tickets as low as $109You might also like[Pre-Chorus]
Oh, ain't nobody hurt you like I hurt you
(Hey-yeah, hey-yeah, hey-yeah)
But ain't nobody need you like I do
(Hey-yeah, hey-yeah, hey-yeah)
I know that there's others that deserve you
(Hey-yeah, hey-yeah, hey-yeah)
But, my darlin', I am still in love with you

[Chorus]
But I guess you look happier, you do
My friends told me one day I'll feel it too
I could try to smile to hide the truth
But I know I was happier with you

[Outro]
'Cause, baby, you look happier, you do
I knew one day you'd fall for someone new
But if he breaks your heart like lovers do
Just know that I'll be waitin' here for you111Embed"
Ed Sheeran,Supermarket Flowers,"I took the supermarket flowers from the windowsill
I threw the day old tea from the cup
Packed up the photo album Matthew had made
Memories of a life that's been loved
Took the get well soon cards and stuffed animals
Poured the old ginger beer down the sink
Dad always told me, ""Don't you cry when you're down""
But mum, there's a tear every time that I blink

[Pre-Chorus]
Oh, I'm in pieces, it's tearing me up, but I know
A heart that's broke is a heart that's been loved

[Chorus]
So I'll sing Hallelujah
You were an angel in the shape of my mum
When I fell down, you'd be there holding me up
Spread your wings as you go
When God takes you back
He'll say, ""Hallelujah, you're home""

[Verse 2]
I fluffed the pillows, made the beds, stacked the chairs up
Folded your nightgowns neatly in a case
John says he'd drive then put his hand on my cheek
And wiped a tear from the side of my face
See Ed Sheeran LiveGet tickets as low as $109You might also like[Pre-Chorus]
And I hope that I see the world as you did 'cause I know
A life with love is a life that's been lived

[Chorus]
So I'll sing Hallelujah
You were an angel in the shape of my mum
When I fell down, you'd be there holding me up
Spread your wings as you go
When God takes you back
He'll say, ""Hallelujah, you're home""

[Bridge]
(Ooh)
(Ooh)
(Ooh)
(Ooh)

[Chorus]
Hallelujah
You were an angel in the shape of my mum
You got to see the person I have become
Spread your wings and I know
That when God took you back
He said, ""Hallelujah, you're home""74Embed"
Ed Sheeran,Perfect Duet,"I found a love for me
Oh, darling, just dive right in and follow my lead
Well, I found a girl beautiful and sweet
Oh, I never knew you were the someone waitin' for me

[Pre-Chorus: Ed Sheeran]
'Cause we were just kids when we fell in love
Not knowin' what it was
I will not give you up this time
But, darling, just kiss me slow
Your heart is all I own
And in your eyes, you're holding mine

[Chorus: Ed Sheeran]
Baby, I'm dancin' in the dark with you between my arms
Barefoot on the grass while listenin' to our favourite song
When you said you looked a mess, I whispered underneath my breath
But you heard it, darling, you look perfect tonight

[Verse 2: Beyoncé]
Well, I found a man stronger than anyone I know
He shares my dreams, I hope that someday we'll share a home
I found a love to carry more than just my secrets
To carry love, to carry children of our own
You might also like[Pre-Chorus: Beyoncé]
We are still kids, but we're so in love
Fighting against all odds
I know we'll be alright this time
Darling, just hold my hand
Be your girl, you'll be my man
And I see my future in your eyes

[Chorus: Beyoncé, Ed Sheeran, Both]
Well, baby, I'm dancin' in the dark with you between my arms
Barefoot on the grass while listenin' to our favorite song
When I saw you in that dress looking so beautiful
I don't deserve this, darling, you look perfect tonight

[Bridge: Beyoncé, Ed Sheeran, Both]
Ah, no, no, no
Ah-ah-oh

[Chorus: Both, Ed Sheeran, Beyoncé]
Baby, I'm dancin' in the dark with you between my arms
Oh, barefoot on the grass while listenin' to our favorite song
I have faith in what I see
Now, I know I have met an angel in person
And she (He) looks perfect
No, I don't deserve this, you look perfect tonight49Embed"
Ed Sheeran,Galway Girl,"She played the fiddle in an Irish band
But she fell in love with an English man
Kissed her on the neck and then I took her by the hand
Said, ""Baby, I just wanna dance""

[Verse 1]
I met her on Grafton Street right outside of the bar
She shared a cigarette with me while her brother played the guitar
She asked me what does it mean, the Gaelic ink on your arm?
Said it was one of my friend's songs, do you wanna drink on?
She took Jamie as a chaser, Jack for the fun
She got Arthur on the table with Johnny riding a shotgun
Chatted some more, one more drink at the bar
Then put Van on the jukebox, got up to dance

[Chorus]
You know, she played the fiddle in an Irish band
But she fell in love with an English man
Kissed her on the neck and then I took her by the hand
Said, ""Baby, I just wanna dance""
With my pretty little Galway Girl
You're my pretty little Galway Girl

[Verse 2]
You know she beat me at darts and then she beat me at pool
And then she kissed me like there was nobody else in the room
As last orders were called was when she stood on the stool
After dancing the céili singing to trad tunes
I never heard Carrickfergus ever sung so sweet
A cappella in the bar using her feet for a beat
Oh, I could have that voice playing on repeat for a week
And in this packed out room, swear she was singing to me
See Ed Sheeran LiveGet tickets as low as $109You might also like[Chorus]
You know, she played the fiddle in an Irish band
But she fell in love with an English man
Kissed her on the neck and then I took her by the hand
Said, ""Baby, I just wanna dance""
My pretty little Galway Girl
My, my, my, my, my, my, my Galway Girl
My, my, my, my, my, my, my Galway Girl
My, my, my, my, my, my, my Galway Girl

[Verse 3]
And now we've outstayed our welcome and it's closing time
I was holding her hand, her hand was holding mine
Our coats both smell of smoke, whisky and wine
As we fill up our lungs with the cold air of the night
I walked her home then she took me inside
To finish some Doritos and another bottle of wine
I swear I'm gonna put you in a song that I write
About a Galway Girl and a perfect night

[Chorus]
She played the fiddle in an Irish band
But she fell in love with an English man
Kissed her on the neck and then I took her by the hand
Said, ""Baby, I just wanna dance""
My pretty little Galway Girl
My, my, my, my, my, my, my Galway Girl
My, my, my, my, my, my, my Galway Girl
My, my, my, my, my, my, my Galway Girl (Hey)78Embed"
Ed Sheeran,Photograph,"Lovin' can hurt
Lovin' can hurt sometimes
But it's the only thing that I know
And when it gets hard
You know it can get hard sometimes
It is the only thing that makes us feel alive

[Pre-Chorus]
We keep this love in a photograph
We made these memories for ourselves
Where our eyes are never closin'
Hearts are never broken
And time's forever frozen still

[Chorus]
So you can keep me
Inside the pocket of your ripped jeans
Holdin' me closer till our eyes meet
You won't ever be alone
Wait for me to come home

[Verse 2]
Lovin' can heal
Lovin' can mend your soul
And it's the only thing that I know, know
I swear it will get easier
Remember that with every piece of ya
Mm, and it's the only thing we take with us when we die
See Ed Sheeran LiveGet tickets as low as $109You might also like[Pre-Chorus]
Mm, we keep this love in this photograph
We made these memories for ourselves
Where our eyes are never closin'
Hearts were never broken
And time's forever frozen still

[Chorus]
So you can keep me
Inside the pocket of your ripped jeans
Holdin' me closer till our eyes meet
You won't ever be alone
And if you hurt me
Well, that's okay, baby, only words bleed
Inside these pages, you just hold me
And I won't ever let you go
Wait for me to come home

[Bridge]
Wait for me to come home
Wait for me to come home
Wait for me to come home

[Chorus]
Oh, you can fit me
Inside that necklace you got when you were sixteen
Next to your heartbeat, where I should be
Keep it deep within your soul
And if you hurt me
Well, that's okay, baby, only words bleed
Inside these pages, you just hold me
And I won't ever let you go
[Outro]
When I'm away, I will remember how you kissed me
Under the lamppost back on Sixth Street
Hearin' you whisper through the phone
""Wait for me to come home""275Embed"
Ed Sheeran,I Donate Care,"I'm at a party I don't wanna be at
And I don't ever wear a suit and tie, yeah
Wonderin' if I could sneak out the back
Nobody's even lookin' me in my eyes
Then you take my hand
Finish my drink, say, ""Shall we dance?"" (Hell, yeah)
You know I love ya, did I ever tell ya?
You make it better like that

[Pre-Chorus: Ed Sheeran]
Don't think I fit in at this party
Everyone's got so much to say (Yeah)
I always feel like I'm nobody, mmm
Who wants to fit in anyway?

[Chorus: Ed Sheeran]
'Cause I don't care when I'm with my baby, yeah
All the bad things disappear
And you're making me feel like maybe I am somebody
I can deal with the bad nights
When I'm with my baby, yeah
Ooh, ooh, ooh, ooh, ooh, ooh
'Cause I don't care as long as you just hold me near
You can take me anywhere
And you're making me feel like I'm loved by somebody
I can deal with the bad nights
When I'm with my baby, yeah
Ooh, ooh, ooh, ooh, ooh, ooh
You might also like[Verse 2: Justin Bieber]
We at a party we don't wanna be at
Tryna talk, but we can't hear ourselves
Read your lips, I'd rather kiss 'em right back
With all these people all around
I'm crippled with anxiety
But I'm told it's where I'm s'posed to be
You know what? It's kinda crazy 'cause I really don't mind
When you make it better like that

[Pre-Chorus: Justin Bieber]
Don't think we fit in at this party
Everyone's got so much to say, oh yeah, yeah
When we walked in, I said I'm sorry, mmm
But now I think that we should stay

[Chorus: Ed Sheeran & Justin Bieber]
'Cause I don't care when I'm with my baby, yeah
All the bad things disappear
Yeah, you're making me feel like maybe I am somebody
I can deal with the bad nights when I'm with my baby, yeah
Ooh, ooh, ooh, ooh, ooh, ooh (Oh yeah, yeah, yeah)
'Cause I don't care as long as you just hold me near
You can take me anywhere
And you're making me feel like I'm loved by somebody
I can deal with the bad nights when I'm with my baby, yeah
Ooh, ooh, ooh, ooh, ooh, ooh (No)
[Bridge: Justin Bieber & Ed Sheeran]
I don't like nobody but you, it's like you're the only one here
I don't like nobody but you, baby, I don't care
I don't like nobody but you, I hate everyone here
I don't like nobody but you, baby, yeah

[Chorus: Ed Sheeran & Justin Bieber]
'Cause I don't care (Don't care)
When I'm with my baby, yeah (Oh yeah)
All the bad things disappear (Disappear)
And you're making me feel like maybe I am somebody (Maybe I'm somebody)
I can deal with the bad nights (With the bad nights)
When I'm with my baby, yeah
Ooh, ooh, ooh, ooh, ooh, ooh (Oh yeah, yeah, yeah)
'Cause I don't care as long as you just hold me near (Me near)
You can take me anywhere (Anywhere, anywhere)
And you're making me feel like I'm loved by somebody
(I'm loved by somebody, yeah, yeah, yeah)
I can deal with the bad nights
When I'm with my baby, yeah
Ooh, ooh, ooh, ooh, ooh, ooh84Embed"
Rihanna,Work,"Work, work, work, work, work, work
He said me haffi work, work, work, work, work, work
He see me do mi dirt, dirt, dirt, dirt, dirt, dirt
Ah so me put in work, work, work, work, work, work
When you ah guh learn, learn, learn, learn, learn, learn?
Me nuh cyar if him hurt, hurt, hurt, hurt, hurting

[Verse 1: Rihanna]
Dry, me ah desert him
Nuh time to have you lurking
Him ah go act like he nuh like it
You know I dealt with you the nicest
Nuh body touch me, you nuh righteous
Nuh badda, text me in a crisis
I believed all of your dreams, adoration
You took my heart and my keys and my patience
You took my heart on my sleeve for decoration
You mistaken my love I brought for you for foundation
All that I wanted from you was to give me
Something that I never had
Something that you've never seen
Something that you've never been, mm
But I wake up and act like nothing's wrong

[Chorus: Rihanna]
Just get ready fi work, work, work, work, work, work
He said me haffi work, work, work, work, work, work
He see me do mi dirt, dirt, dirt, dirt, dirt, dirt
Ah so me put in work, work, work, work, work, work
Ner, ner, ner, ner, ner, ner
When you ah guh learn, learn, learn, learn, learn, learn?
Before the tables turn, turn, turn, turn, turn, turn
You might also like[Verse 2: Rihanna]
Beg you something, please
Baby, don't you leave
Don't leave me stuck here in the streets, uh-huh
If I get another chance to
I will never, no, never neglect you
I mean, who am I to hold your past against you?
I just hope that it gets to you
I hope that you see this through
I hope that you see this true
What can I say?
Please recognize I'm tryin', babe

[Chorus: Rihanna & Drake]
I haffi work, work, work, work, work, work
He said me haffi work, work, work, work, work, work
He see me do mi dirt, dirt, dirt, dirt, dirt, dirt
So me put in work, work, work, work, work, work
When you ah guh learn, learn, learn, learn, learn, learn?
Me nuh cyar if him hurt, hurt, hurt, hurt, hurting (Yeah, okay)

[Verse 3: Drake, Rihanna, Drake & Rihanna]
You need to get done, done, done, done at work, come over
We just need to slow the motion
Don't give that away to no one
Long distance, I need you (Ah)
When I see potential, I just gotta see it through
If you had a twin, I would still choose you
I don't wanna rush into it if it's too soon
But I know you need to get done, done, done, done
If you come over
Sorry if I'm way less friendly
I got niggas tryna end me, oh (Yeah)
I spilled all my emotions tonight, I'm sorry
Rollin', rollin', rollin', rollin', rollin'
How many more shots until you're rollin'?
We just need a face-to-face
You could pick the time and the place
You spent some time away
Now you need to forward
[Chorus: Rihanna, Rihanna & Drake]
And give me all the work, work, work, work, work, work
He said me haffi work, work, work, work, work, work
He see me do mi dirt, dirt, dirt, dirt, dirt, dirt
So me put in work, work, work, work, work, work
When you ah guh learn, learn, learn, learn, learn, learn?
Me nuh cyar if him hurt, hurt, hurt, hurt, hurting

[Outro: Rihanna, Rihanna & Drake]
Mm
Mm
Work, work, work, work, work, work
Mm
[Click here to learn more about the making of ""Work""]
[Produced by Boi-1da]623Embed"
Rihanna,Love on the Brain,"And you got me like, oh
What you want from me? (What you want from me?)
And I tried to buy your pretty heart, but the price too high
Baby, you got me like, oh, mmm
You love when I fall apart (Fall apart)
So you can put me together and throw me against the wall

[Pre-Chorus]
Baby, you got me like, I, woo, I
Don't you stop loving me (Loving me)
Don't quit loving me (Loving me)
Just start loving me, oh (Loving me)

[Chorus]
And, babe, I'm fist-fighting with fire
Just to get close to you
Can we burn something, babe?
And I'll run for miles just to get a taste
Must be love on the brain
That's got me feeling this way (Feeling this way)
It beats me black and blue, but it fucks me so good
And I can't get enough
Must be love on the brain, yeah
And it keeps cursing my name (Cursing my name)
No matter what I do, I'm no good without you
And I can't get enough
Must be love on the brain
You might also like[Verse 2]
Baby, keep loving me
Just love me, yeah
Just love me
All you need to do is love me, yeah
Got me like, ow
I'm tired of being played like a violin
What do I gotta do to get in your motherfuckin' heart?

[Pre-Chorus]
Baby, like, I, woo I
Don't you stop loving me (Loving me)
Don't quit loving me (Loving me)
Just start loving me, ooh (Loving me)

[Chorus]
And, babe, I'm fist-fighting with fire
Just to get close to you
Can we burn something, babe?
And I'll run for miles just to get a taste
Must be love on the brain
That's got me feeling this way (Feeling this way)
It beats me black and blue, but it fucks me so good
And I can't get enough
Must be love on the brain, yeah
And it keeps cursing my name (Cursing my name)
No matter what I do, I'm no good without you
And I can't get enough
Must be love on the brain
[Click here to learn more about the making of ""Love on the Brain""]178Embed"
