artist,title,lyrics
Taylor Swift,Fortnight,"I was supposed to be sent away
But they forgot to come and get me
I was a functioning alcoholic
'Til nobody noticed my new aesthetic
All of this to say I hope you're okay
But you're the reason
And no one here's to blame
But what about your quiet treason?

[Chorus: Taylor Swift]
And for a fortnight there, we were forever
Run into you sometimes, ask about the weather
Now you're in my backyard, turned into good neighbors
Your wife waters flowers, I wanna kill her

[Verse 2: Taylor Swift, Taylor Swift & Post Malone, Post Malone]
All my mornings are Mondays stuck in an endless February
I took the miracle move-on drug, the effects were temporary
And I love you, it's ruining my life
I love you, it's ruining my life
I touched you for only a fortnight
I touched you, but I touched you

[Chorus: Taylor Swift, Taylor Swift & Post Malone]
And for a fortnight there, we were forever
Run into you sometimes, ask about the weather
Now you're in my backyard, turned into good neighbors
Your wife waters flowers, I wanna kill her
And for a fortnight there, we were together
Run into you sometimes, comment on my sweater
Now you're at the mailbox, turned into good neighbors
My husband is cheating, I wanna kill him
See Taylor Swift LiveGet tickets as low as $153You might also like[Bridge: Taylor Swift, Post Malone, Taylor Swift & Post Malone]
I love you, it's ruining my life
I love you, it's ruining my life
I touched you for only a fortnight
I touched you, I touched you
I love you, it's ruining my life
I love you, it's ruining my life
I touched you for only a fortnight
I touched you, I touched you

[Outro: Post Malone, Post Malone & Taylor Swift, Taylor Swift]
Thought of callin' ya, but you won't pick up
'Nother fortnight lost in America
Move to Florida, buy the car you want
But it won't start up 'til you touch, touch, touch me
Thought of calling ya, but you won't pick up
'Nother fortnight lost in America
Move to Florida, buy the car you want
But it won't start up 'til I touch, touch, touch you18Embed"
Taylor Swift,cardigan,"Vintage tee, brand new phone
High heels on cobblestones
When you are young, they assume you know nothing
Sequin smile, black lipstick
Sensual politics
When you are young, they assume you know nothing

[Chorus]
But I knew you
Dancin' in your Levi's
Drunk under a streetlight, I
I knew you
Hand under my sweatshirt
Baby, kiss it better, I

[Refrain]
And when I felt like I was an old cardigan
Under someone's bed
You put me on and said I was your favorite

[Verse 2]
A friend to all is a friend to none
Chase two girls, lose the one
When you are young, they assume you know nothing
See Taylor Swift LiveGet tickets as low as $153You might also like[Chorus]
But I knew you
Playing hide-and-seek and
Giving me your weekends, I
I knew you
Your heartbeat on the High Line
Once in twenty lifetimes, I

[Refrain]
And when I felt like I was an old cardigan
Under someone's bed
You put me on and said I was your favorite

[Bridge]
To kiss in cars and downtown bars
Was all we needed
You drew stars around my scars
But now I'm bleedin'

[Chorus]
'Cause I knew you
Steppin' on the last train
Marked me like a bloodstain, I
I knew you
Tried to change the ending
Peter losing Wendy, I
I knew you
Leavin' like a father
Running like water, I
And when you are young, they assume you know nothing
[Verse 3]
But I knew you'd linger like a tattoo kiss
I knew you'd haunt all of my what-ifs
The smell of smoke would hang around this long
'Cause I knew everything when I was young
I knew I'd curse you for the longest time
Chasin' shadows in the grocery line
I knew you'd miss me once the thrill expired
And you'd be standin' in my front porch light
And I knew you'd come back to me
You'd come back to me
And you'd come back to me
And you'd come back

[Refrain]
And when I felt like I was an old cardigan
Under someone's bed
You put me on and said I was your favorite174Embed"
Taylor Swift,exile,"I can see you standing, honey
With his arms around your body
Laughin', but the joke's not funny at all
And it took you five whole minutes
To pack us up and leave me with it
Holdin' all this love out here in the hall

[Chorus: Justin Vernon]
I think I've seen this film before
And I didn't like the ending
You're not my homeland anymore
So what am I defending now?
You were my town, now I'm in exile, seein' you out
I think I've seen this film before

[Post-Chorus: Justin Vernon]
Ooh, ooh, ooh

[Verse 2: Taylor Swift]
I can see you starin', honey
Like he's just your understudy
Like you'd get your knuckles bloody for me
Second, third, and hundredth chances
Balancin' on breaking branches
Those eyes add insult to injury
See Taylor Swift LiveGet tickets as low as $153You might also like[Chorus: Taylor Swift]
I think I've seen this film before
And I didn't like the ending
I'm not your problem anymore
So who am I offending now?
You were my crown, now I'm in exile, seein' you out
I think I've seen this film before
So I'm leaving out the side door
[Bridge: Justin Vernon, Taylor Swift & Both]
So step right out, there is no amount
Of crying I can do for you
All this time
We always walked a very thin line
You didn't even hear me out (You didn't even hear me out)
You never gave a warning sign (I gave so many signs)
All this time
I never learned to read your mind (Never learned to read my mind)
I couldn't turn things around (You never turned things around)
'Cause you never gave a warning sign (I gave so many signs)
So many signs, so many signs
You didn't even see the signs

[Chorus: Taylor Swift & Justin Vernon, Taylor Swift]
I think I've seen this film before
And I didn't like the ending
You're not my homeland anymore
So what am I defending now?
You were my town, now I'm in exile, seein' you out
I think I've seen this film before
So I'm leavin' out the side door
[Outro: Justin Vernon & Taylor Swift]
So step right out, there is no amount
Of crying I can do for you
All this time
We always walked a very thin line
You didn't even hear me out (Didn't even hear me out)
You never gave a warning sign (I gave so many signs)
All this time
I never learned to read your mind (Never learned to read my mind)
I couldn't turn things around (You never turned things around)
'Cause you never gave a warning sign (I gave so many signs)
You never gave a warning sign (All this time)
(So many times) I never learned to read your mind
(So many signs) I couldn't turn things around (I couldn't turn things around)
'Cause you never gave a warning sign (You never gave a warning sign)
You never gave a warning sign
Ah, ah111Embed"
Taylor Swift,Lover,"We could leave the Christmas lights up 'til January
And this is our place, we make the rules
And there's a dazzling haze, a mysterious way about you, dear
Have I known you twenty seconds or twenty years?
[Chorus]
Can I go where you go?
Can we always be this close?
Forever and ever, ah
Take me out and take me home
You're my, my, my, my lover

[Verse 2]
We could let our friends crash in the living room
This is our place, we make the call
And I'm highly suspicious that everyone who sees you wants you
I've loved you three summers now, honey, but I want 'em all
[Chorus]
Can I go where you go?
Can we always be this close?
Forever and ever, ah
Take me out and take me home (Forever and ever)
You're my, my, my, my lover
See Taylor Swift LiveGet tickets as low as $153You might also like[Bridge]
Ladies and gentlemen, will you please stand?
With every guitar string scar on my hand
I take this magnetic force of a man to be my lover
My heart's been borrowed and yours has been blue
All's well that ends well to end up with you
Swear to be overdramatic and true to my lover
And you'll save all your dirtiest jokes for me
And at every table, I'll save you a seat, lover
[Chorus]
Can I go where you go?
Can we always be this close?
Forever and ever, ah
Take me out and take me home (Forever and ever)
You're my, my, my, my
Oh, you're my, my, my, my
Darling, you're my, my, my, my lover135Embed"
Taylor Swift,The Tortured Poets Department,"You left your typewriter at my apartment
Straight from the tortured poets department
I think some things I never say
Like, ""Who uses typewriters anyway?""
But you're in self-sabotage mode
Throwing spikes down on the road
But I've seen this episode and still loved the show
Who else decodes you?

[Chorus]
And who's gonna hold you like me?
And who's gonna know you, if not me?
I laughed in your face and said
""You're not Dylan Thomas, I'm not Patti Smith
This ain't the Chelsea Hotel, we'rе modern idiots""
And who's gonna hold you like me?

[Post-Chorus]
Nobody
No-fucking-body
Nobody

[Verse 2]
You smokеd, then ate seven bars of chocolate
We declared Charlie Puth should be a bigger artist
I scratch your head, you fall asleep
Like a tattooed golden retriever
But you awaken with dread
Pounding nails in your head
But I've read this one where you come undone
I chose this cyclone with you
See Taylor Swift LiveGet tickets as low as $153You might also like[Chorus]
And who's gonna hold you like me?
(Who's gonna hold you? Who's gonna hold you?)
And who's gonna know you like me?
(Who's gonna know you?)
I laughed in your face and said
""You're not Dylan Thomas, I'm not Patti Smith
This ain't the Chelsea Hotel, we're modern idiots""
And who's gonna hold you like me?
(Who's gonna hold you? Who's gonna hold you?)

[Post-Chorus]
No-fucking-body
(Who's gonna hold you? Who's gonna hold you?)
Nobody
(Who's gonna hold you? Gonna know you? Gonna troll you?)
Nobody

[Bridge]
Sometimes, I wonder if you're gonna screw this up with me
But you told Lucy you'd kill yourself if I ever leave
And I had said that to Jack about you, so I felt seen
Everyone we know understands why it's meant to be
'Cause we're crazy
So tell me, who else is gonna know me?
At dinner, you take my ring off my middle finger
And put it on the one people put wedding rings on
And that's the closest I've come to my heart exploding
[Chorus]
Who's gonna hold you? (Who?)
Me
Who's gonna know you? (Who?)
Me
And you're not Dylan Thomas, I'm not Patti Smith
This ain't the Chelsea Hotel, we're two idiots
Who's gonna hold you?

[Post-Chorus]
Who's gonna hold you?
Who's gonna hold you?
Who's gonna hold you?
Who's gonna hold you?
Who's gonna hold you?
Who's gonna hold you?
Who's gonna hold you?
Gonna know you? Gonna troll you?

[Outro]
You left your typewriter at my apartment
Straight from the tortured poets department
Who else decodes you?8Embed"
Taylor Swift,Down Bad,"Did you really beam me up
In a cloud of sparkling dust
Just to do experiments on?
Tell me I was the chosen one
Showed me that this world is bigger than us
Then sent me back where I came from

[Pre-Chorus]
For a moment, I knew cosmic love

[Chorus]
Now I'm down bad, cryin' at the gym
Everything comes out teenage petulance
""Fuck it if I can't have him""
""I might just die, it would make no difference""
Down bad, wakin' up in blood
Starin' at the sky, come back and pick me up
Fuck it if I can't have us
I might just not get up, I might stay

[Post-Chorus]
Down bad
Fuck it if I can't have him
Down bad
Fuck it if I can't have him
See Taylor Swift LiveGet tickets as low as $153You might also like[Verse 2]
Did you take all my old clothes
Just to leave me here, naked and alone
In a field in my same old town
That somehow seems so hollow now?
They'll say I'm nuts if I talk about
The existence of you

[Pre-Chorus]
For a moment, I was heavenstruck

[Chorus]
Now I'm down bad, cryin' at the gym (Cryin' at the gym)
Everything comes out teenage petulance
""Fuck it if I can't have him"" (Fuck it if I can't have him)
""I might just die, it would make no difference""
Down bad, wakin' up in blood (Wakin' up in blood)
Starin' at the sky, come back and pick me up
Fuck it if I can't have us
I might just not get up, I might stay

[Post-Chorus]
Down bad (Like I lost my twin)
Fuck it if I can't have him (Down bad)
Down bad (Wavin' at the ship)
Fuck it if I can't have him
[Bridge]
I loved your hostile takeovers
Encounters closer and closer
All your indecent exposures
How dare you say that it's—
I'll build you a fort on some planet
Where they can all understand it
How dare you think it's romantic
Leaving me safe and stranded
'Cause fuck it, I was in love
So fuck you if I can't have us
'Cause fuck it, I was in love

[Chorus]
Now I'm down bad, cryin' at the gym (Cryin' at the gym)
Everything comes out teenage petulance
""Fuck it if I can't have him"" (Can't have him)
""I might just die, it would make no difference""
Down bad, wakin' up in blood (Wakin' up in blood)
Starin' at the sky, come back and pick me up
Fuck it if I can't have us
I might just not get up, I might stay

[Post-Chorus]
Down bad (Like I lost my twin)
Fuck it if I can't have him (I'm down bad)
Down bad (Wavin' at the ship)
Fuck it if I can't have him
[Outro]
Like I lost my twin
Fuck it if I can't have him
Down bad (Wavin' at the ship)
Fuck it if I can't have him9Embed"
Taylor Swift,​the 1,"I'm doing good, I'm on some new shit
Been saying ""yes"" instead of ""no""
I thought I saw you at the bus stop, I didn't though
I hit the ground running each night
I hit the Sunday matinée
You know the greatest films of all time were never made

[Pre-Chorus]
I guess you never know, never know
And if you wanted me, you really should've showed
And if you never bleed, you're never gonna grow
And it's alright now

[Chorus]
But we were something, don't you think so?
Roaring twenties, tossing pennies in the pool
And if my wishes came true
It would've been you
In my defense, I have none
For never leaving well enough alone
But it would've been fun
If you would've been the one
(Ooh)

[Verse 2]
I have this dream you're doing cool shit
Having adventures on your own
You meet some woman on the internet and take her home
We never painted by the numbers, baby
But we were making it count
You know the greatest loves of all time are over now
See Taylor Swift LiveGet tickets as low as $153You might also like[Pre-Chorus]
I guess you never know, never know
And it's another day waking up alone

[Chorus]
But we were something, don't you think so?
Roaring twenties, tossing pennies in the pool
And if my wishes came true
It would've been you
In my defense, I have none
For never leaving well enough alone
But it would've been fun
If you would've been the one

[Bridge]
I, I, I persist and resist the temptation to ask you
If one thing had been different
Would everything be different today?

[Chorus]
We were something, don't you think so?
Rosé flowing with your chosen family
And it would've been sweet
If it could've been me
In my defense, I have none
For digging up the grave another time
But it would've been fun
If you would've been the one
(Ooh)103Embed"
Taylor Swift,But Daddy I Love Him,"I forget how the West was won
I forget if this was ever fun
I just learned these people only raise you
To cage you
Sarahs and Hannahs in their Sunday best
Clutchin' their pearls, sighing, ""What a mess""
I just learned these people try and save you
'Cause they hate you

[Pre-Chorus]
Too high a horse
For a simple girl
To rise above it
They slammed the door
On my whole world
The one thing I wanted

[Chorus]
Now I'm runnin' with my dress unbuttoned
Scrеamin', ""But, Daddy, I love him""
I'm havin' his baby
No, I'm not, but you should see your faces
I'm tellin' him to floor it through thе fences
No, I'm not coming to my senses
I know he's crazy, but he's the one I want
See Taylor Swift LiveGet tickets as low as $153You might also like[Verse 2]
Dutiful daughter, all my plans were laid
Tendrils tucked into a woven braid
Growin' up precocious sometimes means
Not growin' up at all
He was chaos, he was revelry
Bedroom eyes like a remedy
Soon enough, the elders had convened
Down at the city hall

[Pre-Chorus]
""Stay away from her""
The saboteurs
Protested too much
Lord knows the words
We never heard
Just screeching tires and true love

[Chorus]
And I'm runnin' with my dress unbuttoned
Screamin', ""But, Daddy, I love him""
I'm havin' his baby
No, I'm not, but you should see your faces
I'm tellin' him to floor it through the fences
No, I'm not coming to my senses
I know he's crazy, but he's the one I want
[Post-Chorus]
I'll tell you something right now
I'd rather burn my whole life down
Than listen to one more second of all this bitchin' and moanin'
I'll tell you something 'bout my good name
It's mine alone to disgrace
I don't cater to all these vipers dressed in empath's clothing

[Bridge]
God save the most judgmental creeps
Who say they want what's best for me
Sanctimoniously performing soliloquies I'll never see
Thinkin' it can change the beat
Of my heart when he touches me
And counteract the chemistry
And undo the destiny
You ain't gotta pray for me
Me and my wild boy and all of this wild joy
If all you want is gray for me
Then it's just white noise, and it's just my choice

[Verse 3]
There's a lot of people in town that I
Bestow upon my fakest smiles
Scandal does funny things to pride, but brings lovers closer
We came back when the heat died down
Went to my parents and they came around
All the wine moms are still holdin' out, but fuck 'em, it's over
[Chorus]
Now I'm dancin' in my dress in the sun and
Even my daddy just loves him
I'm his lady
And, oh my God, you should see your faces
Time, doesn't it give some perspective?
And, no, you can't come to the wedding
I know it's crazy, but he's the one I want

[Post-Chorus]
I'll tell you something right now
You ain't gotta pray for me
Me and my wild boy and all of this wild joy
(He was chaos, he was revelry)
If all you want is gray for me
Then it's just white noise, and it's my choice

[Outro]
Screamin', ""But, Daddy, I love him""
I'm having his baby
No, I'm not
But you should see your faces
But, oh my God, you should see your faces
(He was chaos, he was revelry)
(He was chaos, he was revelry)14Embed"
Taylor Swift,Fortnight,"I was supposed to be sent away
But they forgot to come and get me
I was a functioning alcoholic
'Til nobody noticed my new aesthetic
All of this to say I hope you're okay
But you're the reason
And no one here's to blame
But what about your quiet treason?

[Chorus: Taylor Swift]
And for a fortnight there, we were forever
Run into you sometimes, ask about the weather
Now you're in my backyard, turned into good neighbors
Your wife waters flowers, I wanna kill her

[Verse 2: Taylor Swift, Taylor Swift & Post Malone, Post Malone]
All my mornings are Mondays stuck in an endless February
I took the miracle move-on drug, the effects were temporary
And I love you, it's ruining my life
I love you, it's ruining my life
I touched you for only a fortnight
I touched you, but I touched you

[Chorus: Taylor Swift, Taylor Swift & Post Malone]
And for a fortnight there, we were forever
Run into you sometimes, ask about the weather
Now you're in my backyard, turned into good neighbors
Your wife waters flowers, I wanna kill her
And for a fortnight there, we were together
Run into you sometimes, comment on my sweater
Now you're at the mailbox, turned into good neighbors
My husband is cheating, I wanna kill him
See Taylor Swift LiveGet tickets as low as $153You might also like[Bridge: Taylor Swift, Post Malone, Taylor Swift & Post Malone]
I love you, it's ruining my life
I love you, it's ruining my life
I touched you for only a fortnight
I touched you, I touched you
I love you, it's ruining my life
I love you, it's ruining my life
I touched you for only a fortnight
I touched you, I touched you

[Outro: Post Malone, Post Malone & Taylor Swift, Taylor Swift]
Thought of callin' ya, but you won't pick up
'Nother fortnight lost in America
Move to Florida, buy the car you want
But it won't start up 'til you touch, touch, touch me
Thought of calling ya, but you won't pick up
'Nother fortnight lost in America
Move to Florida, buy the car you want
But it won't start up 'til I touch, touch, touch you18Embed"
Taylor Swift,cardigan,"Vintage tee, brand new phone
High heels on cobblestones
When you are young, they assume you know nothing
Sequin smile, black lipstick
Sensual politics
When you are young, they assume you know nothing

[Chorus]
But I knew you
Dancin' in your Levi's
Drunk under a streetlight, I
I knew you
Hand under my sweatshirt
Baby, kiss it better, I

[Refrain]
And when I felt like I was an old cardigan
Under someone's bed
You put me on and said I was your favorite

[Verse 2]
A friend to all is a friend to none
Chase two girls, lose the one
When you are young, they assume you know nothing
See Taylor Swift LiveGet tickets as low as $153You might also like[Chorus]
But I knew you
Playing hide-and-seek and
Giving me your weekends, I
I knew you
Your heartbeat on the High Line
Once in twenty lifetimes, I

[Refrain]
And when I felt like I was an old cardigan
Under someone's bed
You put me on and said I was your favorite

[Bridge]
To kiss in cars and downtown bars
Was all we needed
You drew stars around my scars
But now I'm bleedin'

[Chorus]
'Cause I knew you
Steppin' on the last train
Marked me like a bloodstain, I
I knew you
Tried to change the ending
Peter losing Wendy, I
I knew you
Leavin' like a father
Running like water, I
And when you are young, they assume you know nothing
[Verse 3]
But I knew you'd linger like a tattoo kiss
I knew you'd haunt all of my what-ifs
The smell of smoke would hang around this long
'Cause I knew everything when I was young
I knew I'd curse you for the longest time
Chasin' shadows in the grocery line
I knew you'd miss me once the thrill expired
And you'd be standin' in my front porch light
And I knew you'd come back to me
You'd come back to me
And you'd come back to me
And you'd come back

[Refrain]
And when I felt like I was an old cardigan
Under someone's bed
You put me on and said I was your favorite174Embed"
Taylor Swift,exile,"I can see you standing, honey
With his arms around your body
Laughin', but the joke's not funny at all
And it took you five whole minutes
To pack us up and leave me with it
Holdin' all this love out here in the hall

[Chorus: Justin Vernon]
I think I've seen this film before
And I didn't like the ending
You're not my homeland anymore
So what am I defending now?
You were my town, now I'm in exile, seein' you out
I think I've seen this film before

[Post-Chorus: Justin Vernon]
Ooh, ooh, ooh

[Verse 2: Taylor Swift]
I can see you starin', honey
Like he's just your understudy
Like you'd get your knuckles bloody for me
Second, third, and hundredth chances
Balancin' on breaking branches
Those eyes add insult to injury
See Taylor Swift LiveGet tickets as low as $153You might also like[Chorus: Taylor Swift]
I think I've seen this film before
And I didn't like the ending
I'm not your problem anymore
So who am I offending now?
You were my crown, now I'm in exile, seein' you out
I think I've seen this film before
So I'm leaving out the side door
[Bridge: Justin Vernon, Taylor Swift & Both]
So step right out, there is no amount
Of crying I can do for you
All this time
We always walked a very thin line
You didn't even hear me out (You didn't even hear me out)
You never gave a warning sign (I gave so many signs)
All this time
I never learned to read your mind (Never learned to read my mind)
I couldn't turn things around (You never turned things around)
'Cause you never gave a warning sign (I gave so many signs)
So many signs, so many signs
You didn't even see the signs

[Chorus: Taylor Swift & Justin Vernon, Taylor Swift]
I think I've seen this film before
And I didn't like the ending
You're not my homeland anymore
So what am I defending now?
You were my town, now I'm in exile, seein' you out
I think I've seen this film before
So I'm leavin' out the side door
[Outro: Justin Vernon & Taylor Swift]
So step right out, there is no amount
Of crying I can do for you
All this time
We always walked a very thin line
You didn't even hear me out (Didn't even hear me out)
You never gave a warning sign (I gave so many signs)
All this time
I never learned to read your mind (Never learned to read my mind)
I couldn't turn things around (You never turned things around)
'Cause you never gave a warning sign (I gave so many signs)
You never gave a warning sign (All this time)
(So many times) I never learned to read your mind
(So many signs) I couldn't turn things around (I couldn't turn things around)
'Cause you never gave a warning sign (You never gave a warning sign)
You never gave a warning sign
Ah, ah111Embed"
Taylor Swift,Lover,"We could leave the Christmas lights up 'til January
And this is our place, we make the rules
And there's a dazzling haze, a mysterious way about you, dear
Have I known you twenty seconds or twenty years?
[Chorus]
Can I go where you go?
Can we always be this close?
Forever and ever, ah
Take me out and take me home
You're my, my, my, my lover

[Verse 2]
We could let our friends crash in the living room
This is our place, we make the call
And I'm highly suspicious that everyone who sees you wants you
I've loved you three summers now, honey, but I want 'em all
[Chorus]
Can I go where you go?
Can we always be this close?
Forever and ever, ah
Take me out and take me home (Forever and ever)
You're my, my, my, my lover
See Taylor Swift LiveGet tickets as low as $153You might also like[Bridge]
Ladies and gentlemen, will you please stand?
With every guitar string scar on my hand
I take this magnetic force of a man to be my lover
My heart's been borrowed and yours has been blue
All's well that ends well to end up with you
Swear to be overdramatic and true to my lover
And you'll save all your dirtiest jokes for me
And at every table, I'll save you a seat, lover
[Chorus]
Can I go where you go?
Can we always be this close?
Forever and ever, ah
Take me out and take me home (Forever and ever)
You're my, my, my, my
Oh, you're my, my, my, my
Darling, you're my, my, my, my lover135Embed"
